,Unnamed: 0,Unnamed: 1,Unnamed: 2,CRS_BIS,CRS_M1,CRS_M2,CRS_M3,Climate Speech Score,Climate Similarity Metric,Unnamed: 9
617,2020-10-08,Bank of Canada,Tiff Macklem: From COVID to climate - the importance of risk management,0,1,1,1,0.731049765163947,0.57568206730034,r201009c
618,2020-10-07,Bank of Japan,Haruhiko Kuroda: COVID-19 and the global economy - impact and challenges from Asia's perspective,0,1,1,0,0.285288045800881,0.43373313369868,r201007d
619,2020-10-07,Central Bank of Ireland,Gabriel Makhlouf: The economist as weaver - a letter to students of economics,0,1,0,1,0.364724746511521,0.52530643493823,r201012e
620,2020-10-06,Central Bank of Malaysia,Nor Shamsiah Mohd Yunus: Launch of the World Bank Sustainable and Inclusive Finance Forum,1,1,1,1,1.46442883955781,0.66548877060377,r201006b
621,2020-10-01,Central Bank of Ireland,Sharon Donnery: Ireland's engagement in Europe and deeper integration of Europe ,0,1,1,0,0.294989250860387,0.46081260684963,r201002b
622,2020-09-30,Deutsche Bundesbank,Jens Weidmann: Introductory panel statement,0,1,0,0,0.216122213832031,0.39355209651761,r200930b
623,2020-09-30,European Central Bank,Christine Lagarde: The monetary policy strategy review - some preliminary considerations,0,1,1,0,0.312112465953611,0.40160482826834,r200930c
624,2020-09-28,Hong Kong Monetary Authority,Eddie Yue: Opening keynote speech at HKIB Annual Banking Conference 2020,0,1,1,0,0.48004739144388,0.46177170872432,r200929a
625,2020-09-28,European Central Bank,Isabel Schnabel: When markets fail - the need for collective action in tackling climate change,1,1,1,1,1.92811574397958,0.77976479721823,r200929e
626,2020-09-25,Bank of France,François Villeroy de Galhau: The role of central banks in the heart of the ecosystem,0,1,1,0,0.204466646987712,0.45049482629409,r200925c
627,2020-09-22,Bank of England,Anna Sweeney: Ask not what the economy can do for insurers - ask what insurers can do for the economy,0,1,1,0,0.512623531817777,0.49180226379746,r200922e
628,2020-09-21,European Central Bank,Christine Lagarde: Jointly shaping Europe's tomorrow,0,1,1,1,0.734471002189824,0.52686804187574,r200921f
629,2020-09-17,Central Bank of Malaysia,"Fraziali Ismail: COVID-19 and climate change, collective responsibility, commitment, and collaboration",1,1,1,1,2.1163798818545,0.79858850239772,r200918a
630,2020-09-15,Deutsche Bundesbank,Sabine Mauderer: Keynote speech - F20 Climate Solutions Week 2020,1,1,1,1,1.84357288835844,0.73712888582452,r200915c
631,2020-09-15,Central Bank of Kenya,Patrick Njoroge: A sustainable future for shared prosperity,0,0,0,1,0.459282902470877,0.50257809031604,r201009d
632,2020-09-14,Reserve Bank of New Zealand,Geoff Bascand: Promoting the soundness and efficiency of our insurance sector - recommencing the IPSA and Solvency Standard review,0,1,1,0,0.620655669419676,0.48092381598995,r200918c
633,2020-09-11,Bank of France,François Villeroy de Galhau: Macro-economic and monetary challenges - towards a stronger economic union post-Covid? ,0,1,0,0,0.412952293993439,0.40270598013248,r200911h
634,2020-09-11,European Central Bank,"Christine Lagarde: Economic, financial and monetary impact of COVID-19 pandemic, and post-crisis options for policies and tools",0,1,0,0,0.153767908583387,0.35050875047606,r200914b
635,2020-09-11,European Central Bank,"Isabel Schnabel: The shadow of fiscal dominance - misconceptions, perceptions and perspectives ",0,1,0,0,0.03332076559405,0.36626147300265,r200914f
636,2020-09-10,Bank of Spain,Margarita Delgado: Appearance before the Ecological Transition and Demographic Challenge Committee,1,1,1,1,1.42803930499005,0.73141548844481,r200924d
637,2020-09-09,Bank of England,Anna Sweeney: Paving the way forward - managing climate risk in the insurance sector ,1,1,1,1,2.55945383502097,0.81653362134838,r200924f
638,2020-09-04,Bank of Italy,Ignazio Visco: Economic growth and productivity - Italy and the role of knowledge,0,1,1,0,0.259492998477766,0.35310094388607,r200908a
639,2020-09-01,Netherlands Bank,"Klaas Knot:  Emerging from the crisis stronger together""- How we can make Europe more resilient, prosperous and sustainable",0,1,0,0,0.155560785145356,0.32753569151439,r200922c
640,2020-08-26,European Central Bank,Isabel Schnabel: Going negative - the ECB's experience,0,1,0,0,0.149612140943303,0.29398124960035,r200827b
641,2020-07-31,South African Reserve Bank,Lesetja Kganyago: Overview of the South African economy,0,1,0,0,-0.170995011420895,0.3985876332068,r200803a
642,2020-07-31,Reserve Bank of New Zealand,Geoff Bascand: Banking the economy in post-COVID Aotearoa,0,1,1,0,0.262209052469478,0.46216392421829,r200918b
643,2020-07-26,Monetary Authority of Singapore,Ravi Menon: Monetary Authority of Singapore's Annual Report 2019/20,0,1,1,0,0.274058189499455,0.44974638732106,r200804f
644,2020-07-23,Bank of Spain,Pablo Hernández de Cos: Challenges for the Spanish economy in the face of the impact of the pandemic,0,1,1,0,0.368190556077163,0.40402909761335,r200807k
645,2020-07-23,Bank of Spain,Pablo Hernández de Cos: Challenges for the Spanish economy in the face of the impact of the pandemic,0,1,1,0,0.368190556077163,0.40402909761335,r200921b
646,2020-07-21,Central Bank of the Philippines,"Benjamin E Diokno: Opportunities for banks in pursuing a green, sustainable economy in the current pandemic",1,1,0,0,0.716343978333818,0.49884131056601,r200807m
647,2020-07-21,Bank of Greece,Yannis Stournaras: European and Greek economic developments and prospects,0,1,0,0,0.229472866618681,0.37149561772859,r200811c
648,2020-07-17,European Central Bank,"Isabel Schnabel: Never waste a crisis - COVID-19, climate change and monetary policy",1,1,1,1,1.34234266851022,0.68330960538182,r200717f
649,2020-07-14,Bank of Botswana,Moses D Pelaelo: Welcome remarks - 2020 Media Economic Briefing,0,1,0,0,0.15996717895274,0.44679483521424,r200811b
650,2020-07-07,Central Bank of Ireland,Gabriel Makhlouf: Macroeconomic impacts of Covid-19 and the monetary and fiscal policy response,0,1,0,0,0.363100110642586,0.4809006410956,r200817i
651,2020-07-01,Bank of England,Sarah Breeden: Leading the change - climate action in the financial sector,1,1,1,1,2.02214573019487,0.78352465459706,r200717h
652,2020-07-01,Netherlands Bank,Frank Elderson: We should aim for a 1.5 degree economy when designing the recovery path,1,1,1,1,1.11911396349697,0.59656379595196,r200804g
653,2020-06-23,Bank of Spain,Pablo Hernández de Cos: The main post-pandemic challenges for the Spanish economy,0,1,1,0,0.413833181090462,0.43564766468658,r200717k
654,2020-06-22,Deutsche Bundesbank,Sabine Mauderer: EU climate goals - staying on track in times of recession?,1,1,1,1,1.42289955063214,0.67537951700448,r200715g
655,2020-06-18,Monetary Authority of Singapore,Ravi Menon: Shanghai and Singapore - financial centre partnership ,0,0,1,0,1.1467578434681,0.47805555150378,r200619a
656,2020-06-17,Central Bank of Ireland,"Sharon Donnery: Risks, resilience and policy responses to Covid-19",0,1,0,0,0.0684078039372579,0.44098972366476,r210211l
657,2020-06-08,Monetary Authority of Singapore,Jacqueline Loh: Keeping green and impact in focus,1,1,1,1,1.26098579042273,0.60709171910074,r200608a
658,2020-06-08,European Central Bank,Christine Lagarde: Hearing at the Committee on Economic and Monetary Affairs of the European Parliament,0,1,1,0,0.375742237844261,0.41298121515103,r200609a
659,2020-05-28,Reserve Bank of New Zealand,Adrian Orr: A near horizon - seizing the opportunities and managing the risks in the transition to net zero - the importance of climate-related financial disclosures,1,1,1,1,1.84869796435945,0.74679444040756,r200605a
660,2020-05-22,European Central Bank,Philip R Lane: International inflation co-movements,0,1,0,0,0.144891425495724,0.3811909287512,r200525b
661,2020-05-19,Bank of England,Charlotte Gerken: Life beyond Solvency II - a view from the top of the regulator,0,1,1,1,0.633191615139755,0.51644574488337,r200528a
662,2020-05-14,Bank of France,François Villeroy de Galhau: European solidarity put to the test by the health crisis,0,1,1,0,0.278771585642515,0.37071185918263,r200515a
663,2020-04-29,Netherlands Bank,Frank Elderson: A green light to lead us on the path of economic recovery,1,1,1,1,1.04394918006379,0.59742192689229,r200529b
664,2020-03-20,Bank of Finland,Olli Rehn: Economic effects of the corona crisis and measures by the central banks,0,1,1,0,0.177340564041295,0.46079775594679,r200324a
665,2020-03-05,Bank of England,Mark Carney: The grand unifying theory (and practice) of macroprudential policy,0,1,1,0,0.0878129501501414,0.44342262465626,r200306c
666,2020-03-04,Federal Reserve System,Kevin Stiroh: Climate change and risk management in bank supervision,1,1,1,1,1.9988408282701,0.82254830422445,r200309b
667,2020-03-03,European Central Bank,Luis de Guindos: Capital markets union - the role of equity markets and sustainable finance,0,1,1,0,0.655369300894814,0.45263882260695,r200304a
668,2020-03-03,Sveriges Riksbank,Anna Breman: How the Sveriges Riksbank can contribute to climate policy,1,1,1,1,1.38123407647423,0.69772451579016,r200304g
669,2020-02-28,Deutsche Bundesbank,Jens Weidmann: Introductory comments at the press conference to present the annual accounts ,0,1,1,0,0.517329681279033,0.46861789218413,r200306h
670,2020-02-27,European Central Bank,Christine Lagarde: Climate change and the financial sector,1,1,1,1,1.63885450499178,0.72053259674568,r200302c
671,2020-02-27,Bank of Italy,Ignazio Visco: Returns - identifying the opportunity in the transition to net zero,0,1,1,0,0.692062502329286,0.49593597525406,r200302d
672,2020-02-27,Bank of England,Mark Carney: The road to Glasgow,0,1,1,1,1.54661439725165,0.65940996497586,r200304d
673,2020-02-25,Bank of Spain,Pablo Hernández de Cos: Economic and financial policy geared to climate goals ,1,1,1,1,1.40155463347033,0.6888506661948,r200228e
674,2020-02-25,Bank of Botswana,Moses D Pelaelo: Botswana's 2020 Monetary Policy Statement,0,1,0,0,-0.140776140646262,0.40168229399801,r200326b
675,2020-02-21,Reserve Bank of New Zealand,Adrian Orr: Aiming for great and best for Te Pūtea Matua,0,1,1,1,0.507415534080106,0.50409064097714,r200221a
676,2020-02-13,Central Bank of Norway,Øystein Olsen: Economic perspectives ,0,1,1,0,0.115389365586253,0.36562958424742,r200217c
677,2020-02-13,Reserve Bank of New Zealand,Christian Hawkesby: Guardianship - the Māori world view of the Reserve Bank of New Zealand,0,1,1,0,0.662699117832051,0.46019686334607,r200217d
678,2020-02-13,Bank of Spain,Pablo Hernández de Cos: Thoughts on global financial stability and the European Capital Markets Union,0,1,1,0,0.390521053152302,0.48422140543674,r200228d
679,2020-02-13,National Bank of Romania,"Mugur Isărescu: Opening speech - conference ""Investment and Investment Finance in Romania""",0,0,1,0,0.542833654682734,0.41606671264381,r200305a
680,2020-02-12,Central Bank of Ireland,Gabriel Makhlouf: The decade ahead,0,1,0,0,0.28825206323692,0.47131805738911,r200212e
681,2020-02-11,Bank of England,Jon Cunliffe: Governance of financial globalisation,0,1,1,0,0.352911023362778,0.47361480782025,r200211e
682,2020-02-11,European Central Bank,Christine Lagarde: Debate about the Annual Report,0,1,1,1,0.799602708548606,0.56977546439608,r200211f
683,2020-02-11,European Central Bank,Isabel Schnabel: Narratives about the ECB's monetary policy - reality or fiction?,0,1,1,0,0.0384942063999847,0.37481256564801,r200212a
684,2020-02-10,European Central Bank,Isabel Schnabel: Interview in Die Welt,0,1,1,0,0.310295553669679,0.44922407358292,r200212d
685,2020-02-08,Bank of Italy,"Ignazio Visco: The economic outlook, the challenges for the financial system and for regulators",0,1,1,0,0.110102726711316,0.43589028681775,r200211b
686,2020-02-06,European Central Bank,Christine Lagarde: Hearing at the Committee on Economic and Monetary Affairs of the European Parliament ,0,1,0,0,0.254390032308084,0.4115302715287,r200206b
687,2020-02-06,European Central Bank,Luis de Guindos: The euro area financial sector - opportunities and challenges,0,1,1,0,0.389177857183332,0.44327784842058,r200206c
688,2020-02-06,European Central Bank,Luis de Guindos: Interview in Expansión,0,1,1,0,0.264534009989517,0.46504423697516,r200217b
689,2020-02-06,Bank of Italy,Luigi Federico Signorini: Sustainable investment in uncertain times - the future of public sector asset management,0,1,1,0,0.491575578149792,0.49374418376569,r200817b
690,2020-02-05,European Central Bank,Christine Lagarde: Remarks on the occasion of receiving the Grand Prix de l'Économie 2019 from Les Echos,1,1,1,1,1.28933051418807,0.7354116246884,r200205b
691,2020-02-05,Reserve Bank of Australia,Philip Lowe: The year ahead,0,1,0,0,-0.206166193617753,0.28517921596568,r200206a
692,2020-02-03,Deutsche Bundesbank,Jens Weidmann: Change and continuity ,0,1,0,0,0.121579245972672,0.38801325326309,r200204b
693,2020-02-03,Bank of Greece,Yannis Stournaras: European and Greek economic developments and prospects,0,1,1,0,0.174391211476405,0.3736352515056,r200204e
694,2020-01-31,Central Bank of Ireland,Sharon Donnery: Central banks and public policy - stability in an interconnected world,0,1,1,1,0.835575590105776,0.61263545026082,r200203i
695,2020-01-30,Deutsche Bundesbank,Claudia Buch: Risks and resilience in the financial system - a German perspective,0,1,1,0,0.0689944955306355,0.38813425961379,r200203c
696,2020-01-29,Reserve Bank of New Zealand,Christian Hawkesby: The global economy and New Zealand,0,1,0,0,0.0935909928912872,0.33269515140117,r200130b
697,2020-01-28,Bank of Spain,Pablo Hernández de Cos: Multilateralism and globalisation reforms,0,1,0,0,0.21125781358191,0.40587546609963,r200130a
698,2020-01-28,Central Bank of the Philippines,"Benjamin E Diokno: The Philippine economy - towards a more inclusive, A-rated economy",0,1,0,0,-0.0262285113369799,0.42247297649349,r200204g
699,2020-01-24,European Central Bank,Christine Lagarde: Interview with Bloomberg TV,0,1,1,1,0.909532673887874,0.55083663898742,r200128b
700,2020-01-23,European Central Bank,Christine Lagarde: How can a united Europe meet the challenges it faces today?,0,1,1,0,0.621966374800004,0.47242962869476,r200128a
701,2020-01-21,Central Bank of Kenya,Patrick Njoroge: An African vision for sustainable finance,1,1,1,1,2.28011663635934,0.7044093321582,r200205e
702,2020-01-16,European Central Bank,Christine Lagarde: Frankfurt and Europe in a new decade,0,1,0,0,0.455683056842299,0.41338119573653,r200121c
703,2020-01-16,Reserve Bank of Fiji,Ariff Ali: The Fijian insurance industry ,0,1,1,0,0.361989956764254,0.42623010565621,r200130d
704,2020-01-16,Central Bank of The Bahamas,John A Rolle: Towards a financial sector disaster recovery plan for The Bahamas,0,1,0,0,0.16345075226214,0.46016209815047,r200203e
705,2020-01-15,Bank of France,François Villeroy de Galhau: New Year wishes to the Paris financial centre ,0,1,0,0,0.268207808710349,0.44861537175704,r200115a
706,2020-01-09,Deutsche Bundesbank,Claudia Buch: A changing economy - should policymakers act?,0,1,1,1,0.887963482613885,0.61797945487977,r200123a
707,2020-01-08,Netherlands Bank,Klaas Knot: Interests and alliances,0,1,1,1,1.3571347237388,0.671428719628,r200108b
708,2020-01-08,European Central Bank,"Christine Lagarde: Interview in ""Challenges"" magazine",0,1,1,0,0.230609339922666,0.40590255445529,r200108d
709,2019-12-18,European Central Bank,Benoît Cœuré: Monetary policy - lifting the veil of effectiveness,0,1,0,0,0.167218948860093,0.41687449654453,r191218b
710,2019-12-17,Bank of England,"Mark Carney: Remarks at a farewell dinner in honour of Benoît Coeuré, member of the ECB Executive Board",0,1,1,0,0.120073641097162,0.46296940054359,r191218a
711,2019-12-13,Bank of Spain,"Pablo Hernández de Cos: Welcome address - ""Financial integration and inclusive development: A view from the Mediterranean Countries""",0,1,0,1,0.277253105132455,0.53052507646252,r191213d
712,2019-12-12,Swiss National Bank,"Andréa M Maechler: Introductory remarks, Swiss National Bank news conference",0,0,1,0,0.0345459836627669,0.40917552854052,r191213a
713,2019-12-12,Swiss National Bank,"Thomas Jordan: Introductory remarks, Swiss National Bank news conference  ",0,1,1,0,0.0366144300905631,0.39890769092341,r191213b
714,2019-12-12,Swiss National Bank,"Fritz Zurbrügg: Introductory remarks, Swiss National Bank news conference",0,1,1,1,0.790359897123932,0.5657276252657,r191213c
715,2019-12-12,European Central Bank,Christine Lagarde: Interview with NOS Nieuwsuur,0,1,1,1,0.637987071956925,0.52146266218761,r191217c
716,2019-12-12,Bank of Spain,Margarita Delgado: Remarks at panel on climate change,0,1,1,1,1.58976766068526,0.7557934113225,r191218e
717,2019-12-11,Central Bank of Kuwait,Mohammad Y Al-Hashel: Regulation and supervision - from old fault lines to emerging concerns,0,1,1,1,1.1284469711433,0.66811563750744,r191211c
718,2019-12-11,Bank of Spain,Margarita Delgado: Climate change. Challenges for the financial system ,1,1,1,1,2.73746642397149,0.8573465327781,r191211e
719,2019-12-11,Netherlands Bank,Frank Elderson: Climate crisis requires urgent action by financial sector and financial supervisors,1,1,1,1,1.66316783856674,0.72136837643385,r191211h
720,2019-12-10,Bank of England,Mark Carney: Remarks at a panel to launch the third annual America's Pledge report,0,1,1,1,2.21760657601587,0.68372021557214,r191211a
721,2019-12-08,Bank of Japan,Haruhiko Kuroda: A perspective on the future of Asia ,0,1,1,0,0.399775666230154,0.43793644545269,r191213g
722,2019-12-04,Deutsche Bundesbank,Claudia Buch: Capital Markets Union - a central banking perspective on the way forward,0,1,0,0,-0.0131252679866235,0.41658008150778,r191210c
723,2019-12-04,European Central Bank,Benoît Cœuré: Interview in Libération,0,1,1,0,0.0415409103123398,0.38819626495709,r191217a
724,2019-12-03,Danmarks Nationalbank,Lars Rohde: Challenges for the pension section in a low interest environment,0,1,0,0,0.0863279579350494,0.43584299092198,r191203c
725,2019-12-03,European Central Bank,Benoît Cœuré: The single currency - an unfinished agenda,0,1,1,0,0.256769056074525,0.35127835889698,r191204a
726,2019-12-03,Central Bank of Malaysia,Adnan Zaylani Mohamad Zahid: Sustainability and the challenges ahead,1,1,1,1,1.32830802332371,0.66111743292328,r191204b
727,2019-12-03,Bank of Spain,Pablo Hernández de Cos: Low interest rates for longer. Profitability and risk appetite in the Spanish banking sector,0,1,1,0,0.0950342370503714,0.33621894487974,r191211d
728,2019-12-02,European Central Bank,Christine Lagarde: Hearing of the Committee on Economic and Monetary Affairs of the European Parliament,0,1,0,0,0.174153898428361,0.39241428666083,r191202f
729,2019-12-02,Danmarks Nationalbank,Lars Rohde: The impact of climate change on financial stability and the need for a European banking union ,1,1,1,1,1.11185638064429,0.62888039066751,r191203b
730,2019-11-29,Bank of Mauritius,Yandraduth Googoolye: Shaping the new banking landscape - defining the priorities and leveraging new technology to propel the Mauritian financial system forward,0,1,1,0,0.114285642719031,0.48207729922099,r191202e
731,2019-11-28,Bank of Japan,"Haruhiko Kuroda: International financial regulation and supervision - past achievements, current issues, and future agendas",0,1,1,1,0.710369716034466,0.5634025485949,r191128a
732,2019-11-28,Bank of France,François Villeroy de Galhau: European and French economic outlook and post-Brexit financial architecture,0,1,1,0,0.467395843826549,0.4907943001668,r191128b
733,2019-11-28,European Central Bank,Philip R Lane: Determinants of the real interest rate,0,1,1,0,0.199385622641278,0.38238848822044,r191129a
734,2019-11-28,European Central Bank,Benoît Cœuré: Economics as a profession - from science to practice,0,1,1,1,0.577830647103406,0.54214086489698,r191129b
735,2019-11-28,Deutsche Bundesbank,Jens Weidmann: Consistency as a mandate ,0,1,1,1,0.629112220066972,0.53043490125202,r191129c
736,2019-11-28,Bank of Japan,Masazumi Wakatabe: Financial and settlement systems as social infrastructure - disaster management perspective,0,1,1,0,0.335979915900674,0.44073266988282,r191227b
737,2019-11-25,Bank of Thailand,Veerathai Santiprabhob: Thailand 2025 - dealing with major trends,0,1,1,1,0.491065571954875,0.57825923137583,r191202g
738,2019-11-22,European Central Bank,Christine Lagarde: The future of the euro area economy,0,1,0,0,0.14738825220941,0.34624398528681,r191122b
739,2019-11-22,Central Bank of Malaysia,"Adnan Zaylani Mohamad Zahid: Charting the next financial sector blueprint - digitisation, climate change and resilience",1,1,1,0,0.103194426460348,0.43667793432484,r191129e
740,2019-11-21,Bank of France,Denis Beau: What policy framework to help building innovation and growth into Europe's capital market? ,0,1,0,0,0.334157471468011,0.49909848728043,r191122c
741,2019-11-21,European Central Bank,Luis de Guindos: Implications of the transition to a low-carbon economy for the euro area financial system,1,1,1,1,1.93299496019972,0.72238916503008,r191122e
742,2019-11-21,Deutsche Bundesbank,Claudia Buch: The Deutsche Bundesbank's 2019 Financial Stability Review,0,1,1,0,0.282131746401065,0.42896447155895,r191122f
743,2019-11-21,Central Bank of the Philippines,Benjamin E Diokno: Sustainable finance towards a climate-resilient Philippine economy,1,1,1,1,1.75095844049653,0.75424494195608,r191127h
744,2019-11-20,Central Bank of Ireland,Gabriel Makhlouf: Resilience through transitions - facing the tumult,0,1,1,1,0.505867248765781,0.534287851655,r191120a
745,2019-11-19,Central Bank of Malta,Mario Vella: Progressing safely in a riskier world ,0,1,1,0,0.295713273379502,0.47299905761286,r191120e
746,2019-11-19,Netherlands Bank,Frank Elderson: Are we doing enough?,0,1,1,1,2.02981898336611,0.74841572091501,r191122j
747,2019-11-19,Bank of Canada,Carolyn Wilkins: Financial stability in an uncertain world ,0,1,1,0,0.33066186112784,0.49644476550252,r191220f
748,2019-11-18,European Central Bank,Philip R Lane: Q&A with Fortune ,0,1,0,0,0.102631759210006,0.41449228019589,r191120d
749,2019-11-15,Bank of Spain,Margarita Delgado: The management of non-financial risk ,0,0,0,1,0.575944563569729,0.61661451663151,r191115j
750,2019-11-14,Swiss National Bank,Andréa M Maechler: Climate risks and central banks - an SNB perspective  ,1,1,1,1,1.20795544182884,0.6638939478708,r191115a
751,2019-11-14,European Central Bank,Philip R Lane: Interview in La Repubblica,0,1,0,0,0.0947362628579751,0.36316312012072,r191120c
752,2019-11-13,Sveriges Riksbank,Martin Flodén: Monetary policy in a changing world,0,1,1,1,0.6415338042097,0.53932647872549,r191113c
753,2019-11-13,Reserve Bank of India,Mahesh Kumar Jain: Rural and agriculture finance - critical input to achieve inclusive and sustainable development,0,1,0,0,-0.058277864091361,0.35848909768295,r191129f
754,2019-11-08,Central Bank of Norway,"Egil Matsen: Climate change, climate risks and Norges Bank",1,1,1,1,1.7132684740196,0.72647372013791,r191108a
755,2019-11-08,Federal Reserve System,Lael Brainard: Why climate change matters for monetary policy and financial stability,1,1,1,1,1.06161593058105,0.67327041746847,r191111a
756,2019-11-08,Netherlands Bank,Frank Elderson: Discussing financial risks during wildfire,1,1,1,1,1.90869873414133,0.74607199417009,r191112f
757,2019-11-07,Federal Reserve System,Kevin Stiroh: Emerging issues for risk managers,0,1,1,1,1.20159867651414,0.69309818901831,r191107a
758,2019-11-07,Federal Reserve System,John C Williams: The gold beneath our feet,0,1,1,1,0.336872614137747,0.51637816012172,r191107b
759,2019-11-07,Bank of Finland,Olli Rehn: Global and European economy from the Finnish perspective,0,1,1,0,0.391297866199135,0.44664660698488,r191107f
760,2019-11-06,Central Bank of Malaysia,Adnan Zaylani Mohamad Zahid: Ethics & professionalism - leaders as role models for the next generation of Islamic finance professionals,0,1,0,0,0.328324437761004,0.32513135686111,r191107e
761,2019-11-05,Reserve Bank of New Zealand,Adrian Orr: Building confidence and reducing risks in the insurance sector,0,1,0,0,0.394575890150006,0.42715262031604,r191105a
762,2019-10-31,Bank of Finland,Marja Nykänen: Problems in embedding climate risks into the traditional financial risk framework,1,1,1,1,1.95919082149848,0.72581325586662,r191031a
763,2019-10-31,Bank of Spain,Margarita Delgado: Decarbonising the economy,1,1,1,1,1.69856905406547,0.73537274758705,r191113e
764,2019-10-30,Bank of Finland,Olli Rehn: Making the best out of second-best climate policies,1,1,1,1,2.14245893502164,0.81010515813469,r191030b
765,2019-10-30,European Central Bank,Sabine Lautenschläger: A call for Europe,0,1,1,1,0.814469204973147,0.57610116000633,r191031b
766,2019-10-29,Deutsche Bundesbank,Jens Weidmann: Climate change and central banks,1,1,1,1,2.09027964034109,0.80514662340409,r191029a
767,2019-10-29,Deutsche Bundesbank,Sabine Mauderer: Central banks - a crisis manager for the climate?,1,1,1,1,1.21260943270059,0.63486711316077,r191029b
768,2019-10-28,European Central Bank,Mario Draghi: Farewell remarks,0,1,0,0,0.154817863445431,0.34892955430128,r191028a
769,2019-10-24,Central Bank of The Bahamas,John A Rolle: Bahamian financial resilience post-natural disasters,1,1,1,1,0.459349474150015,0.52090188260295,r191104c
770,2019-10-21,Bank of England,Andrew G Haldane: Understanding pay gaps,0,1,0,0,0.162654821253579,0.40219718610112,r191023b
771,2019-10-20,Bank of Japan,Haruhiko Kuroda: For sustainable development of emerging economies,1,1,1,0,0.344865335839864,0.49379824640183,r191021a
772,2019-10-19,Bank of Mexico,Javier Guzmán Calafell: Developing sustainable capital markets - mapping the challenges and setting priorities,1,1,1,1,1.46092023938512,0.70539156406247,r191021c
773,2019-10-18,Bank of France,"Denis Beau: Ten years after Lehman, is the financial system safer?",0,1,1,0,0.293168934637256,0.4878748120656,r191023a
774,2019-10-17,Deutsche Bundesbank,Joachim Wuermeling: A new world ahead. What do sustainable finance and digitalisation mean for supervision?,1,1,1,1,1.49824277752323,0.67542195645538,r191017f
