,Unnamed: 0,Unnamed: 1,Unnamed: 2,CRS_BIS,CRS_M1,CRS_M2,CRS_M3,Climate Speech Score,Climate Similarity Metric,Unnamed: 9
775,2019-10-17,Deutsche Bundesbank,Sabine Mauderer: US Senate Democrats' Special Committee on the climate crisis,1,1,1,1,1.75751681411686,0.77214495354101,r191018a
776,2019-10-17,Central Bank of Norway,Egil Matsen: US Senate Democrats' Special Committee on the climate crisis,1,1,1,1,1.24962209963164,0.63867400252218,r191018g
777,2019-10-17,European Central Bank,Luis de Guindos: Speaking notes on climate-related risks,0,0,1,1,1.83683248413277,0.57602652054108,r191018h
778,2019-10-17,Bank of France,Denis Beau: What European financial sovereignty in a digital world ,0,0,0,1,0.425994871539253,0.50212567243397,r191025a
779,2019-10-16,Deutsche Bundesbank,"Joachim Wuermeling: Introduction to the book ""Banking Business in Germany""",0,0,1,0,0.190339640552362,0.46883565242589,r191016c
780,2019-10-16,Deutsche Bundesbank,Jens Weidmann: Continental drift? - Transatlantic economic relations in turbulent times,0,1,0,0,0.0846238561339775,0.37124910525382,r191017a
781,2019-10-14,Bank of Spain,Pablo Hernández de Cos: Financial stability situation in Spain,0,1,0,0,0.0985329663209743,0.35480674316029,r191105f
782,2019-10-11,European Central Bank,"Mario Draghi: Policymaking, responsibility and uncertainty",0,1,1,0,0.146209397032353,0.42577419969948,r191011d
783,2019-10-11,Hong Kong Monetary Authority,Arthur Yuen: Greening financial institutions,1,1,1,1,1.27087928413993,0.62987789214293,r191014c
784,2019-10-10,Central Bank of the Philippines,"Benjamin E Diokno: The Philippine economy - moving the financial services industry forward through inclusive technology, green initiatives",1,1,1,1,0.571618245296029,0.51588052425189,r191023f
785,2019-10-09,Monetary Authority of Singapore,Jacqueline Loh: The changing world,0,0,1,0,0.243758617043424,0.38103870113454,r191011a
786,2019-10-08,Bank of England,Mark Carney: TCFD - strengthening the foundations of sustainable finance,1,1,1,1,2.24389995481424,0.74631639706125,r191008a
787,2019-10-08,Danmarks Nationalbank,Per Callesen: The role of financing and regulation amid broader policies to mitigate climate change,1,1,1,1,2.04005048374361,0.77978978603563,r191008f
788,2019-10-08,Central Bank of Malaysia,Adnan Zaylani Mohamad Zahid: Leading in a disruptive world - revolutionising Takaful,0,1,0,0,0.5401524060163,0.37965984939499,r191009b
789,2019-10-04,Reserve Bank of Australia,"Luci Ellis: Lumps, bumps and waves",0,1,1,0,0.26092105427326,0.45103622620416,r191007d
790,2019-10-04,Bank of Greece,Yannis Stournaras: Building public-private partnerships,0,1,1,0,0.54237276913462,0.39504023151395,r191007o
791,2019-10-03,Central Bank of Ireland,Sharon Donnery: A long view on the task ahead,0,1,1,1,0.983053648239826,0.6508210201068,r191007i
792,2019-10-02,Netherlands Bank,Frank Elderson: Two issues to take on together,0,0,1,1,0.674422943133322,0.56714493436439,r191007c
793,2019-09-30,Bank of Finland,Olli Rehn: Next steps towards a stronger monetary union,0,0,1,0,0.209502205166254,0.36159563406041,r191001k
794,2019-09-27,Central Bank of Ireland,Ed Sibley: Insurance Ireland - PwC CEO Survey Report Breakfast Briefing,0,1,1,1,0.852630494524417,0.59012103244156,r190930h
795,2019-09-27,Reserve Bank of New Zealand,Adrian Orr: Emerging challenges and lessons from the  Māori Economic Renaissance,0,1,1,0,0.553716402168255,0.46832350822441,r191001f
796,2019-09-26,Bank of Italy,Ignazio Visco: Sustainable development and climate risks - the role of central banks,1,1,1,1,1.36674929863666,0.70041304405819,r190930f
797,2019-09-25,Central Bank of Malaysia,Nor Shamsiah Mohd Yunus: Keynote address - Regional Conference on Climate Change,1,1,1,1,1.90483092658393,0.78324401088457,r190926a
798,2019-09-24,Bank of France,François Villeroy de Galhau: Current challenges of monetary policy ,0,1,0,0,0.0081971421461441,0.40326371725016,r190924a
799,2019-09-23,Bank of England,Mark Carney: Remarks given during the UN Secretary General's Climate Action Summit 2019,1,1,1,1,1.88701414543342,0.69046544171051,r190924b
800,2019-09-23,Deutsche Bundesbank,Claudia Buch: Evidence-based policy - progress and next steps,0,1,0,0,0.17651295403525,0.47273853310691,r190925a
801,2019-09-23,Central Bank of Malaysia,Abdul Rasheed Ghaffour: Unlocking full potential of Islamic finance through sustainability,0,1,1,0,0.526914077485965,0.41973611028793,r190925g
802,2019-09-19,Bank of Greece,Yannis Stournaras: Greece in Europe - reasons for optimism,0,1,1,0,0.184343138810922,0.38925198591951,r191023e
803,2019-09-18,Bank of France,"François Villeroy de Galhau: What economic sovereignty for Europe? Facing the threats with lucidity, and boldly seizing an opportunity ",0,1,1,0,0.315887087638334,0.42687279921037,r190919n
804,2019-09-18,Bank of Spain,Pablo Hernández de Cos: Monetary policy and bank profitability in an environment of uncertainty,0,1,1,0,0.125704468804021,0.33744372854421,r190924f
805,2019-09-17,Bank of France,François Villeroy de Galhau: The role of banking in a sustainable global economy,1,1,1,1,1.38111843580777,0.70060495223335,r190918a
806,2019-09-16,Bank of Spain,Pablo Hernández de Cos: The EMU at 20 - from divergence to resilience,0,1,1,0,0.150266281661563,0.33698975657481,r190916a
807,2019-09-13,National Bank of Romania,"Florin Georgescu: Closing remarks - ""Inclusion and financial stability"" seminar",0,1,0,0,0.165844961308361,0.49759015838637,r191009n
808,2019-09-12,National Bank of Romania,"Mugur Isărescu: Opening remarks - ""Inclusion and financial stability"" seminar",0,0,1,1,0.433304797517506,0.50994252139832,r191009m
809,2019-09-11,Bank of Finland,Olli Rehn: Which economic and financial priorities for fostering growth and innovation in the EU?,0,1,0,0,0.298344748545304,0.4447334979703,r190911c
810,2019-09-10,Bank of Spain,Pablo Hernández de Cos: Global imbalances and capital flows in the era of new technologies,0,1,0,0,0.37486643073712,0.43917168393331,r190910a
811,2019-09-03,Bank of Uganda,Emmanuel Tumusiime-Mutebile: Building a 21st century Ugandan economy ,0,1,0,0,-0.0477830362243042,0.39184463697281,r190904g
812,2019-09-03,Bank of Uganda,Emmanuel Tumusiime-Mutebile:  Building a 21st century Ugandan economy,0,1,0,0,-0.0477830362243042,0.39184463697281,r191008b
813,2019-09-02,Bank of England,"Alex Brazier: Stability, agility, opportunity",0,1,1,1,0.918325932434872,0.56093795644154,r190903g
814,2019-08-30,Netherlands Bank,Frank Elderson: We all play a vital role,0,1,1,1,1.98622506742111,0.76893807837808,r190904c
815,2019-08-19,Bank of Finland,Olli Rehn: Global economic outlook - a European perspective,0,1,1,0,0.0710573916712842,0.37980476493332,r190820c
816,2019-08-15,Reserve Bank of Australia,Guy Debelle: Risks to the outlook,0,1,1,0,0.170628701295771,0.38908737715973,r190815c
817,2019-08-13,Bank of Thailand,Veerathai Santiprabhob: Opening remarks - Bangkok Sustainable Banking Forum 2019,1,0,0,0,0.166903236541286,0.41988635162191,r190903a
818,2019-08-01,Monetary Authority of Singapore,Jacqueline Loh: A coordinated and forward looking approach towards ASEAN disaster and climate risk resilience,1,1,1,1,0.963678742706951,0.60139330978481,r190812c
819,2019-07-26,Reserve Bank of India,Shaktikanta Das: India's relations with the International Monetary Fund,0,1,0,0,-0.0120880961355595,0.4074400385581,r190729n
820,2019-07-25,Central Bank of Barbados,Cleviston Haynes: Critical minds for critical times - economic research as a building block for transformative growth in the Caribbean ,0,1,0,1,0.531469670191744,0.52654602895995,r190820f
821,2019-07-16,Bank of France,François Villeroy de Galhau: 75 years later - thinking about the next 75,0,1,1,0,0.343494531261004,0.47072085984182,r190716k
822,2019-07-11,Monetary Authority of Singapore,"Ravi Menon: The wellness of investing - eating well, sleeping well, feeling well",0,1,1,1,1.18072790948669,0.62284492422557,r190711n
823,2019-07-11,Reserve Bank of New Zealand,Adrian Orr: The evolving Reserve Bank - the view from Tāne Māhuta,0,1,1,0,0.2423327061795,0.40017951153361,r190829c
824,2019-07-09,Deutsche Bundesbank,Burkhard Balz: Digital transformation - a central bank perspective ,0,0,0,1,0.38212991564031,0.52954260706625,r190711g
825,2019-07-09,Bank of France,François Villeroy de Galhau: New frontiers in finance ,0,1,1,1,1.04204700466211,0.59841824108477,r190712i
826,2019-07-01,Bank of Finland,"Olli Rehn: Challenges of monetary policy - past, present, future",0,1,0,0,0.0761138703857441,0.38658398014135,r190715n
827,2019-06-28,Bank of Greece,Yannis Stournaras: The Greek economy 10 years after the crisis and lessons for the future both for Greece and the Eurozone,0,1,1,0,0.298187742790717,0.44417012404289,r190816e
828,2019-06-26,Reserve Bank of New Zealand,Geoff Bascand: Renewing the RBNZ's approach to financial stability,0,1,0,0,0.190388442762011,0.43293013286462,r190829e
829,2019-06-25,Hong Kong Monetary Authority,Eddie Yue: Hong Kong - the Asian hub for sustainable finance,1,1,1,0,1.19381652980198,0.48496397212786,r190627f
830,2019-06-25,European Central Bank,Benoît Cœuré: European capital markets - priorities and challenges,0,1,0,0,0.119874475873536,0.39604460713001,r190627h
831,2019-06-20,Bank of England,"Mark Carney: Enable, empower, ensure - a new finance for the new economy ",0,1,1,1,0.555522950936898,0.52610018283942,r190627a
832,2019-06-17,Central Bank of Malaysia,Nor Shamsiah Mohd Yunus: Shifting tides - future of finance,0,1,1,1,0.480422995010972,0.52126896285197,r190617a
833,2019-06-13,Swiss National Bank,Andréa M Maechler: Developments in Swiss and international financial and foreign exchange markets,0,1,0,0,-0.00698244777834865,0.42840059090784,r190613h
834,2019-06-13,European Central Bank,Luis de Guindos: Interview in Corriere della Sera ,0,1,0,0,0.00864762350951003,0.350436869065,r190617b
835,2019-06-13,Deutsche Bundesbank,Sabine Mauderer: Scaling up green finance - the role of central banks,1,1,1,1,1.39059568498348,0.63574832311735,r190617i
836,2019-06-12,South African Reserve Bank,Lesetja Kganyago: Multilateralism and central bank independence,0,1,1,0,0.153807581443879,0.44328620131157,r190613e
837,2019-06-12,European Central Bank,Benoît Cœuré: Interview in the Financial Times,0,1,1,1,0.54450175877843,0.56607569832472,r190617g
838,2019-06-10,Bank of France,Denis Beau: Navigating a changing weather,1,1,0,0,0.191552655685335,0.44513546204051,r190617d
839,2019-06-04,Federal Reserve System,John C Williams: Banking culture - the path ahead,0,1,1,0,0.118671394401921,0.48174385191585,r190604e
840,2019-06-03,Bank of Finland,Olli Rehn: Building an enabling environment for circular businesses,1,1,1,1,0.935200082655707,0.5772328516579,r190604b
841,2019-05-31,Bank of Greece,Yannis Stournaras: A retrospective on euro area monetary policy during and after the recent financial crisis,0,1,1,0,0.247776717454288,0.43496270240603,r190612i
842,2019-05-30,Bank of England,David Ramsden: Resilience - three lessons from the financial crisis,0,1,0,0,-0.0340526405101271,0.40852881173014,r190603e
843,2019-05-24,Deutsche Bundesbank,"Claudia Buch: Evidence-based policy - potentials, infrastructures and the role of international organizations",0,1,0,0,0.184641112927121,0.46625418902093,r190524a
844,2019-05-24,Bank of Finland,Olli Rehn: Impact of structural economic changes on monetary and macroprudential policies,0,1,0,0,0.12367229798939,0.4445240433113,r190524c
845,2019-05-23,European Central Bank,Luis de Guindos: Building the EU's capital markets - what remains to be done,0,1,0,0,0.154935952205598,0.35739974067612,r190523d
846,2019-05-23,Central Bank of Ireland,Philip R Lane: The academy and the economy,0,1,1,1,0.655767138788018,0.61480559223791,r190523e
847,2019-05-21,Bank of France,"Denis Beau: Emerging supervisory priorities - technology, risk culture and sustainability",0,1,1,1,1.40075136329993,0.67038883998573,r190521i
848,2019-05-21,Bank of Italy,Ignazio Visco: Sustainable development and climate risks - the role of central banks,1,1,1,1,1.38147903707893,0.68535932411505,r190604i
849,2019-05-20,Bank of Greece,John Iannis Mourmouras: Fostering British-Greek economic ties in the post-Brexit era.,0,1,0,0,0.219809175922199,0.38704419604094,r190612h
850,2019-05-20,Central Bank of Solomon Islands,Denton Rarawa: Launch of the 2018 CBSI Annual Report,0,1,0,0,-0.0317298161289463,0.39916760476848,r191008l
851,2019-05-17,Central Bank of Barbados,Cleviston Haynes:  Bio-digestion - benefits to Barbados,1,1,1,1,1.58836110977307,0.58328991209408,r190612f
852,2019-05-16,Bank of Canada,Stephen S Poloz: Release of the Financial System Review,0,1,1,1,0.52763910981816,0.53813923092997,r190517a
853,2019-05-16,Central Bank of Ireland,Sharon Donnery: Risks and opportunities from climate change,1,1,1,1,2.03813848773715,0.77739240276812,r190517h
854,2019-05-14,Monetary Authority of Singapore,"Ravi Menon: Can the three musketeers click? Finance, technology, trust",0,1,0,0,0.318737137505868,0.41913797227088,r190514d
855,2019-05-09,Bank of Finland,Olli Rehn: Living with populism - reflections on the economy and democracy in Europe,0,1,0,0,0.191745158793396,0.41571438146645,r190514a
856,2019-05-08,Bank of England,David Ramsden: Resilience and innovation in post-trade,0,1,0,0,0.196007664316024,0.48991336849113,r190508e
857,2019-05-08,Central Bank of Ireland,"Ed Sibley: Functioning of the insurance market, key industry issues and challenges ahead",0,1,1,1,0.637007690575625,0.53988688831725,r190508i
858,2019-05-07,Hong Kong Monetary Authority,Norman T L Chan: Green finance - turning momentum into action,1,1,1,1,1.38663302331226,0.62114697031766,r190508b
859,2019-05-07,National Bank of Romania,Mugur Isărescu: Opening speech -16th meeting of the Financial Stability Board Regional Consultative Group for Europe,0,1,1,1,0.769377970660472,0.59132145407098,r190904a
860,2019-05-02,Bank of Finland,Olli Rehn: European economic and monetary policy outlook,0,1,0,0,0.203797841595729,0.4170364043985,r190503a
861,2019-05-02,Bank of Mauritius,Yandraduth Googoolye: The need to adapt regulatory and supervisory structures to changing technologies and business models,0,1,1,0,0.224691592943527,0.4999076178689,r190613b
862,2019-04-29,Bank of England,Mark Carney: A platform for innovation,0,1,1,1,1.27202818606855,0.63078467351735,r190430c
863,2019-04-17,Bank of France,François Villeroy de Galhau: Central banks and supervisors taking action on climate change,1,1,1,1,2.03972932578304,0.73721668117291,r190429e
864,2019-04-17,European Central Bank,"Sabine Lautenschläger: Central bankers, supervisors and climate-related risks ",0,1,1,1,2.42181223763407,0.8259920619364,r190429i
865,2019-04-17,Bank of Finland,Olli Rehn: Economic outlook and monetary policy - a European perspective,0,1,0,0,0.239058269572939,0.30025999095191,r190502g
866,2019-04-17,Netherlands Bank,"Frank Elderson: Network for Greening the Financial System's recommendations for policymakers, central bankers and supervisors",1,1,1,1,1.75804036813586,0.70487685508936,r190513g
867,2019-04-16,Central Bank of Ireland,Philip R Lane: Tail risks and the Irish economy,0,1,1,0,0.326926956980833,0.48631462091869,r190429f
868,2019-04-15,Bank of England,Sarah Breeden: Avoiding the storm - climate change and the financial system,1,1,1,1,2.46095041224057,0.81046481887995,r190430k
869,2019-04-12,Federal Reserve System,Kevin Stiroh: Thoughts on cybersecurity from a supervisory perspective,0,0,0,1,0.321180139331759,0.53322829640888,r190430l
870,2019-04-11,Netherlands Bank,Klaas Knot: The future agenda for financial sector reforms; financial stability and regulatory developments for the financial industry,0,1,0,0,0.179910017205127,0.47182556699193,r190430s
871,2019-04-10,Bank of England,David Rule: An annuity is a very serious business: Part Two,0,1,1,0,0.299255828599264,0.44658540662159,r190410e
872,2019-04-08,Central Bank of Norway,Øystein Olsen: Economic perspectives ,0,1,1,1,0.639625103188541,0.52484431798032,r190410d
873,2019-04-03,Bank of Greece,"Yannis Stournaras: Climate change - threats, challenges, solutions for Greece",0,1,1,1,2.54358981623585,0.89481180774113,r190412g
874,2019-04-01,Bank of Canada,Stephen S Poloz: Turbulent times for trade,0,1,1,0,0.0553873964948769,0.37967580097222,r190402a
875,2019-03-29,Reserve Bank of New Zealand,Adrian Orr:  In service to society - New Zealand's revised monetary policy framework and the imperative for institutional change,0,1,1,0,0.118733840530744,0.40032277707678,r190329c
876,2019-03-26,Bank of France,Denis Beau: Opportunities and risks of evolving sources of financing for the economy  ,0,1,1,1,0.698895052267828,0.52059162425956,r190329b
877,2019-03-21,Bank of England,Mark Carney: A New Horizon,1,1,1,1,2.41530658406182,0.81234048865765,r190322a
878,2019-03-19,Deutsche Bundesbank,"Joachim Wuermeling: What will pass, what will still be around, and what will come? The prospects for Germany's banking sector",0,1,1,0,0.284950081790299,0.48953519499154,r190319a
879,2019-03-15,Bank of Japan,Haruhiko Kuroda: Toward inclusive and sustainable development,1,1,1,1,0.701969992624055,0.55672462749775,r190503c
880,2019-03-13,Central Bank of Morocco,Abdellatif Jouahri: Digital transformation - Fintech opportunities and risks - Implementing the Bali Fintech Agenda ,0,0,0,1,0.324060087422757,0.5201396807161,r190912c
881,2019-03-12,Bank of Spain,Margarita Delgado: Sustainable finance as the driving force of the ecological transition,1,1,1,1,1.61092848282069,0.75410001647949,r190313c
882,2019-03-12,Reserve Bank of Australia,Guy Debelle: Climate change and the economy,1,1,1,1,1.78178233589101,0.79449263443453,r190313d
883,2019-03-11,Netherlands Bank,Frank Elderson: Changing gears - about cycling and the future of banking,0,1,1,0,0.339296011731029,0.47660905373211,r190315c
884,2019-02-21,National Bank of Romania,Mugur Isărescu: Introductory speech - CEPS Ideas Lab: Europe's Choice conference,0,1,0,0,0.0364930902154025,0.41081263863342,r190318i
885,2019-02-20,Central Bank of Kenya,Patrick Njoroge: The importance of green finance guidelines as Nairobi seeks to become a global hub,0,1,1,1,2.71752836420223,0.69650859506719,r190321d
886,2019-02-15,Central Bank of Ireland,Ed Sibley: Towards a more resilient insurance industry,0,1,1,1,0.557438053240464,0.52067678713493,r190218a
887,2019-02-14,Central Bank of Norway,Øystein Olsen: Economic perspectives ,0,1,1,1,0.467703022631843,0.50326253104852,r190215d
888,2019-02-13,Central Bank of Ireland,Philip R Lane: The Brexit discontinuity,0,1,0,0,0.257094071271932,0.48291255916719,r190213c
889,2019-02-05,Central Bank of Ireland,Philip R Lane: Climate change and the Irish financial system,1,1,1,1,1.57548357206521,0.74109567698055,r190206b
890,2019-02-04,European Central Bank,Benoît Cœuré: Interview in Risques,0,1,1,0,0.111388672785112,0.41277494313775,r190402c
891,2019-01-29,Bank of Finland,Olli Rehn: The euro beyond 20 - monetary policy in the real economy,0,1,1,0,0.166623107581433,0.40933447422843,r190131e
892,2019-01-17,Central Bank of Ireland,Ed Sibley: Safety and soundness - strategic priorities for the next three years,0,1,1,1,0.401758061129506,0.50907032566534,r190117e
893,2019-01-17,European Central Bank,Sabine Lautenschläger: A supervisory perspective on 2019 and beyond,0,1,0,0,0.377780568249983,0.49950454659907,r190117h
894,2019-01-16,Bank of France,Denis Beau: Financial markets - driving innovation and connectivity,0,1,1,1,0.827255842670791,0.58827295348522,r190116d
895,2019-01-16,Bank of France,François Villeroy de Galhau: New Year wishes to the Paris financial centre ,0,0,1,0,0.359139110160072,0.4862203292502,r190124a
896,2019-01-04,European Central Bank,Benoît Cœuré:  Interview with France Inter,0,1,1,0,0.0722872407817884,0.39460051396952,r190108a
897,2018-12-07,Deutsche Bundesbank,Claudia Buch: Experience and evidence,0,1,1,0,0.278196921455438,0.47468306288246,r181210d
898,2018-12-04,Bank of France,"Denis Beau: Old and new challenges for the insurance sector, its regulators and supervisors",0,1,1,1,0.869098002639481,0.5862564761453,r181220a
899,2018-11-29,Central Bank of Iceland,"Rannveig Sigurdardóttir: Security, privacy and the need for cooperation to fight cyber threats",0,0,0,1,0.155427681091882,0.51832811730616,r181220l
900,2018-11-28,Bank of France,"François Villeroy de Galhau: The role of finance - anticipating climate risks, financing transition opportunities ",1,1,1,1,1.75492393392018,0.73206093244715,r181129c
901,2018-11-27,European Central Bank,Yves Mersch: Climate change and central banking,1,1,1,1,0.951697671492845,0.6331389677545,r181128b
902,2018-11-26,European Central Bank,Benoît Cœuré: The role of the European Union in fostering convergence,0,1,1,0,0.275619066064454,0.402299887887,r181220p
903,2018-11-22,Bank of England,Andrew G Haldane: The creative economy,0,1,0,0,0.357093133033451,0.4246590030801,r190225d
904,2018-11-21,Bank of England,Mark Carney: Remarks at the Accounting for Sustainability Summit 2018,0,1,1,1,2.47984743195198,0.85698649507844,r181122b
905,2018-11-15,Bank of Italy,Ignazio Visco: Building human capital for 21st century jobs ,0,1,0,0,0.28283266729078,0.44750862916285,r181121f
906,2018-11-13,Reserve Bank of New Zealand,"Geoff Bascand: Financial stability - risky, safe, or just right?",0,1,1,0,0.128721518618141,0.43089941138771,r181113d
907,2018-11-11,Bank of Finland,Olli Rehn: Future proofing your bank? Digital transformation and regulatory reform in the financial sector,0,1,1,1,1.35969645683087,0.67465567228435,r181113j
908,2018-11-08,European Central Bank,Benoît Cœuré: Monetary policy and climate change,1,1,1,1,1.28472173092449,0.66471964008873,r181109f
909,2018-10-30,Bank of Spain,Pablo Hernández de Cos: Financial disintermediation and the future of the banking sector,0,1,0,0,0.0934453574791352,0.37550504760031,r181030h
910,2018-10-30,European Central Bank,"Sabine Lautenschläger: Ten years after the crisis - risks, rules and supervision",0,1,1,1,0.326197068426178,0.50778699659195,r181031e
911,2018-10-26,Bank of France,François Villeroy de Galhau: Pushing back the limits of insurability,0,1,1,1,0.926974412291282,0.58299010322519,r181114b
912,2018-10-25,Bank of Japan,"Masazumi Wakatabe: The post-crisis world - evolution of the economy, economics, and central banks",0,1,0,0,0.023547223411672,0.46152992908169,r181030b
913,2018-10-14,The People's Bank of China,"Yi Gang: Global economic developments, the outlook for China and the need for IMF reform",0,1,0,0,0.0392023137523263,0.41157551945165,r181107d
914,2018-10-11,National Bank of Romania,Florin Georgescu: Challenging the status quo in management and economics,0,1,0,0,0.310733405212919,0.48290941016502,r181018c
915,2018-10-03,Central Bank of Malaysia,Nor Shamsiah Mohd Yunus: Value based intermediation - beyond profit,0,1,1,0,0.473566375039753,0.45443435079178,r181003e
916,2018-10-02,Bank of Thailand,Veerathai Santiprabhob: Global risks and Thailand's economic outlook,0,1,0,0,-0.0991366001907695,0.4420744485712,r181002a
917,2018-10-01,Bank of Greece,Yannis Stournaras: Challenges and prospects for sustainable growth,0,1,1,1,2.14038893355704,0.84797164118289,r181015c
918,2018-09-26,Bank of England,"David Rule: A ""D to Z"" of current issues in insurance supervision",0,1,0,0,0.164872977068692,0.32849407787923,r181002c
919,2018-09-15,Bank of Thailand,"Veerathai Santiprabhob: Digital technologies, financial system and central bank policy",0,0,0,1,0.176334613783347,0.51389833262308,r180920a
920,2018-09-07,Reserve Bank of New Zealand,"Adrian Orr: Geopolitics, New Zealand and the winds of change",0,1,1,0,0.415591381895614,0.47982131042651,r180910f
921,2018-09-04,Netherlands Bank,"Frank Elderson: ""Let's dance""",0,0,1,1,0.953490887417327,0.56766987174958,r180904c
922,2018-08-09,Central Bank of Malaysia,Nor Shamsiah Mohd Yunus: DFIs of the future - maximising development impact,0,1,0,0,0.353155810299657,0.4638422614996,r180814d
923,2018-07-27,Central Bank of Ireland,Philip R Lane: Macro-financial policies for the short term and the long term,0,1,1,0,0.367187374030132,0.47197207609836,r180817b
924,2018-07-23,Bank of Thailand,Veerathai Santiprabhob: Opening remarks - Bangkok Sustainable Banking Forum 2018 ,0,1,0,1,0.561625377248293,0.51693608265274,r180723j
925,2018-07-17,Central Bank of Malaysia,"Jessica Chew Cheng Lian: Innovative risk management - GO BOLA! (Go Beyond, Go Original, Go agiLe, Go Ahead)",0,1,0,0,0.366531065909807,0.48317383575318,r180723d
926,2018-06-21,Bank of England,"Mark Carney: New economy, new finance, new bank",0,0,1,0,0.117700936092093,0.41333817970763,r180627d
927,2018-06-21,Deutsche Bundesbank,Claudia Buch: The future of the euro area - the perspective of central banks,0,1,0,0,0.166718968098294,0.46890423650592,r180719k
928,2018-06-18,European Central Bank,"Peter Praet: Interview in BdP Revista, staff magazine of Bank of Portugal",0,1,0,0,-0.00373856469209962,0.33361645085344,r181105c
929,2018-06-15,Bank of Italy,Ignazio Visco: Bank of Italy - The Global Foundation,0,1,1,1,0.662362974918541,0.5590421128692,r180627j
930,2018-06-15,European Central Bank,Benoît Cœuré: Interview with Europe 1 ,0,1,0,0,0.110717060847156,0.38528453065962,r180705b
931,2018-06-14,Hong Kong Monetary Authority,Norman Chan: Welcome remarks - 2018 Green and Social Bond Principles Annual Conference,1,0,1,0,1.12676328046696,0.43139172073328,r180725f
932,2018-06-13,Bank of Finland,Olli Rehn: Climate change and green finance,1,1,1,1,1.74789348553912,0.76974335132936,r180725b
933,2018-05-28,Bank of France,François Villeroy de Galhau: Presentation of the 2017 Annual Report of the ACPR,0,0,1,0,0.380273715665507,0.48410255822839,r180724i
934,2018-05-03,Central Bank of the Philippines,"Nestor A Espenilla, Jr: ASEAN+3 - emergence, sustainability and success",0,1,0,0,0.0735948281929469,0.4244167156844,r180524e
935,2018-04-30,Deutsche Bundesbank,Andreas Dombret: Mediating between worlds - eight years at the Bundesbank ,0,1,1,0,0.22297013710389,0.47336562229845,r180515e
