,id,paragraph
236,r221222c,"attended probably with no correspondent fall in the rate of wages; for the fall of price, "
237,r221222c,"and the distress, will be understood to be temporary, and the rate of wages, we know, "
238,r221222c,"is  not  so  variable  as  the  price  of  goods. There  is  reason,  therefore,  to  fear  that  the "
239,r221222c,unnatural and extraordinary low price arising from the sort of distress of which we 
240,r221222c,"now speak, would occasion much discouragement of the fabrication of manufactures. "
241,r221222c,"(Thornton 1978, pp. 118-19) "
242,r221222c,"Thornton, like Hume, notes that the reason the diminution of money affects employment is "
243,r221222c,the rigidity of money wage contracts. He believes that if wages fall to the extent that prices 
244,r221222c,"do  at  the  same  time,  there  will  be  no  effect  on  employment.  However,  because  there  is "
245,r221222c,"downward  rigidity  in  the  rate  of  wages,  a  fall  in  prices  will  affect  the  real  economy.  His "
246,r221222c,"depiction of this influence, as well as his use of the term ""industry"" in the following quote, is "
247,r221222c,reminiscent of Hume. 
248,r221222c,13  Hicks (1967b) relates this tendency to Keynes's liquidity preference theory. 
249,r221222c,9 
250,r221222c,                                                              A great diminution of notes prevents much of that industry of the country which had 
251,r221222c,been exerted from being so productive as it would otherwise be. When a time either of 
252,r221222c,"multiplied failures, or even of much disappointment in the expected means of effecting "
253,r221222c,"payments  arises,  plans  of  commerce  and  manufacture,  as  well  as  of  general "
254,r221222c,"improvement of every kind, which had been entered upon, are changed or suspended, "
255,r221222c,"and part of the labour which had been bestowed proves, therefore, to have been thrown "
256,r221222c,away. . . . The goods which ought to form part of the assortment of the factor or the 
257,r221222c,"shopkeeper,  and  to  be  occupying  their  premises,  are  loading  the  warehouse  of  the "
258,r221222c,"manufacturer, and, perhaps, are suffering damage by too long detention. On the other "
259,r221222c,"hand,  some  sales  are  forced;  and  thus  the  goods  prepared  for  one  market,  and  best "
260,r221222c,"suited to it, are sold at another. There cease, at such a time, to be that regularity and "
261,r221222c,"exactness  in  proportioning  and  adapting  the  supply  to  the  consumption,  and  that "
262,r221222c,"dispatch  in  bringing  every  article  from  the  hands  of  the  fabricator  into  actual  use, "
263,r221222c,"which are some of the great means of rendering industry productive, and of adding to "
264,r221222c,the general substance of a country. Every great and sudden check given to paper credit 
265,r221222c,"not only operates as a check to industry, but leads also to much of this misapplication "
266,r221222c,"of it. (Thornton 1978, pp. 119-21) "
267,r221222c,Thornton does not mention the long-term effects of such a check to and misapplication of 
268,r221222c,"industry.  Nor  did  Thornton  himself  consider  inflation  preferable  to  deflation.  However, "
269,r221222c,fluctuations in the quantity of money are clearly undesirable as they have a negative impact 
270,r221222c,"on the real economy, at least in the short run. "
271,r221222c,"In  relation  to  Thornton's  second  accomplishment,  the  extent  to  which  manufacturers  and "
272,r221222c,merchants receive bank loans is determined by the relationship between their expected profit 
273,r221222c,rates and market interest rates. If the market interest rate is lower than the rate of expected 
274,r221222c,"profit, bank lending will increase, the quantity of money will increase, and prices will rise. "
275,r221222c,"On the other hand, if the market interest rate is higher than the rate of expected profit, bank "
276,r221222c,"lending  will  decrease,  the  quantity  of  money  will  decrease,  and  prices  will  fall. Thornton "
277,r221222c,"distinguishes between nominal and real interest rates, taking into account changes in inflation "
278,r221222c,10 
279,r221222c,        expectations.14  His account of changes in inflation expectations was later taken up by Irving 
280,r221222c,"Fisher, while his two-interest-rate analysis was later adopted by Knut Wicksell; both form the "
281,r221222c,theoretical basis of modern macroeconomics. 
282,r221222c,"This  brings  us  to  Thornton's  third  accomplishment,  which  is  an  inquiry  into  the  policy "
283,r221222c,"responses of central banks. At the time of the Bank Restriction Period, the BOE did not see "
284,r221222c,"itself as a central bank. Thornton argued that it should act as one. First, he stated that central "
285,r221222c,banks should act to stabilize price fluctuations by setting market interest rates consistent with 
286,r221222c,"expected  profit rates. Then,  as Walter  Bagehot  would  later emphasize, they  should  supply "
287,r221222c,"liquidity in times of financial crisis. When a financial crunch occurs, people's demand for "
288,r221222c,"money surges, giving rise to moves to withdraw money from the banking system. At such a "
289,r221222c,"time, it would be reasonable for an individual bank to simply reduce lending, but if all banks "
290,r221222c,"were  to  act  in  the  same  way,  lending  in  the  economy  as  a  whole  would  dwindle  further. "
291,r221222c,"Thornton argued that, in times of a financial crunch, the BOE should rather provide liquidity "
292,r221222c,to the economy by lending generously. 
293,r221222c,C. Subsequent Developments 
294,r221222c,"Since I have discussed subsequent developments elsewhere, here I will touch on topics related "
295,r221222c,to our current context.15  Thornton was concerned about deflation but thought it would last 
296,r221222c,"only  for  the  short  run.  However,  the  time  came  when  Europe  was  exposed  to  prolonged "
297,r221222c,deflationary pressure. The question as to whether the mild deflation seen at the end of the 
298,r221222c,19th century -- lasting from 1873 to 1896 -- had an impact on the real economy remains a 
299,r221222c,"matter  of  debate.  Some  argue  that  at  that  time  it  was  ""good  deflation""  under  which "
300,r221222c,"productivity  improved,  while  others  focus  on  the  adjustment  capability  of  the  economic "
301,r221222c,"structure of the 19th century, where labor and product markets were flexible. However, some "
302,r221222c,"recent studies have shown that, after correcting for errors in the measurement of price data, "
303,r221222c,"14  Thornton  (1978,  pp.  335-36)  made this distinction  in  his speech to  the  UK  Parliament  in  1811.  According to Humphrey (1983), William Douglass -- born in Scotland in the 18th century -- was the  first to distinguish between real and nominal interest rates.  15  See Wakatabe (2009, 2015, 2017). "
304,r221222c,11 
305,r221222c,                                                            the deflation had a negative impact on the real economy (Kaufmann 2020).16 
306,r221222c,It  was  during  this  period  that  the  quantity  theory  of  money  evolved  into  the  supply  and 
307,r221222c,"demand theory of money advanced by Alfred Marshall, as well as by Fisher and Wicksell. In "
308,r221222c,"essence, the theory parallels the innovation in economics that occurred around the same time, "
309,r221222c,"known as the marginal revolution, and is closely related to the full-fledged application of the "
310,r221222c,supply  and  demand  theory  to  pricing  goods  and  services. 17   Wicksell  explored  ways  of 
311,r221222c,"defining the natural rate of interest, but took this to mean a long-term rather than a short-term "
312,r221222c,interest rate.18   
313,r221222c,"The  Great  Depression  of  the  1930s  was  accompanied  by  severe  deflation.  At  this  time, "
314,r221222c,monetary economics made great strides forward and the field of macroeconomics was born. 
315,r221222c,John  Maynard  Keynes's  innovation  lay  in  constructing  a  principle  of  effective  demand.  I 
316,r221222c,"should note that, whereas the most successful interpretation of Keynes, the IS-LM model, "
317,r221222c,"assumes the rigidity of wages and prices, Keynes himself did not premise his ideas on wage "
318,r221222c,"or price rigidity. He sought to argue that the more flexible wages and prices are, the more "
319,r221222c,unstable the economy becomes.19   
320,r221222c,Elevated inflation came on the scene in the 1970s.20  This is the period when Milton Friedman 
321,r221222c,"and the monetarist school of economics took the world by storm. However, Friedman's work "
322,r221222c,in economics is really an extension of Keynesian economics. The well-known equation for 
323,r221222c,"the quantity theory of money is MV = PQ, where M is quantity of money, V is velocity of "
324,r221222c,"money, P is price level, and Q is quantity of real output, and PQ on the right-hand side of the "
325,r221222c,equation reflects nominal GDP. It is also possible to regard the left-hand side as corresponding 
326,r221222c,"16  Fischer (1996) considered that the deflationary period started much earlier and characterized the  period  from  the  1820s  to  the  1890s  as  the  ""Victorian  equilibrium.""  See  Cameron's  (1997)  critical  review of Fischer's argument. See also Wakatabe (2013, pp. 255-59).  17  See Laidler (1991). Edgeworth's (1888) paper served as another important discussion of the time  regarding the basic theory of central banks.  18  As Rogoff, Rossi, and Schmelzing (2022, p. 8n9) argue, Wicksell's definition of the natural rate of  interest is an economy-wide average concept encompassing both short- and long-term interest rates.  19  His  hypothesis  was  later  followed  by  the  construction  of  disequilibrium  economic  theory,  but  remains unproved.  20  With regard to the Great Inflation of the 1970s, see Wakatabe (2022).   "
327,r221222c,12 
328,r221222c,                                                              to money supply and the right-hand side as corresponding to money demand. If we assume 
329,r221222c,"the  causality  from  money  supply,  Friedman's  argument  is  that  money  supply  determines "
330,r221222c,"nominal  GDP.  For  changes  in  nominal  GDP,  the  extent  to  which  either  the  price  level  or "
331,r221222c,quantity of real output changes depends on the shape of the aggregate supply curve. If real 
332,r221222c,"output were constant, a change in M would cause only prices to change. However, real output "
333,r221222c,"is not necessarily constant. Although the neutrality of money holds in the long run, the short-"
334,r221222c,run non-neutrality of money is an understanding inherited from the classical school. 
335,r221222c,Of key relevance to the contemporary debate is Friedman's argument that cost-push factors 
336,r221222c,do not lead to sustained inflation. 
337,r221222c,It is essential to distinguish changes in relative prices from changes in absolute prices. 
338,r221222c,The special conditions that drove up the prices of oil and food required purchasers to 
339,r221222c,"spend more on them, leaving less to spend on other items. Did that not force other "
340,r221222c,prices to go down or to rise less rapidly than otherwise? Why should the average level 
341,r221222c,of all prices be affected significantly by changes in the prices of some things relative 
342,r221222c,"to others? Thanks to delays in adjustment, the rapid rises in oil and food prices may "
343,r221222c,"have temporarily raised the rate of inflation somewhat. . . . [H]owever, . . . the basic "
344,r221222c,source  of  inflation  is  the  faster  growth  in  the  quantity  of  money  than  in  output. 
345,r221222c,(Friedman 1974)21 
346,r221222c,"Another area that came to draw attention during this period was the role of ""expectations"" in "
347,r221222c,economics.  Inflation  expectations  rather  than  exogenous  cost-push  factors  contribute  to 
348,r221222c,sustained inflation. Reining in the Great Inflation called for subduing inflation expectations. 
349,r221222c,"Although  this  stress  on  expectations  is  particularly  tied  in  with  the  ""rational  expectations "
350,r221222c,"revolution"" associated with Robert E. Lucas Jr. and Thomas J. Sargent, among others, the "
351,r221222c,"concept of expectations has been taken up throughout the history of monetary economics, "
352,r221222c,with different theorists approaching it differently. There was also a growing awareness that 
353,r221222c,monetary policy plays an important role in stabilizing inflation expectations to bring about 
354,r221222c,"price stability. Inflation targeting, which is the monetary policy framework now adopted by "
355,r221222c,"21  See also Kakino (2019, p. 93). "
356,r221222c,13 
357,r221222c,"                                                              central banks in many countries, was born out of lessons learned from the Great Inflation of "
358,r221222c,the  1970s.  This  awareness  spread  gradually  through  both  academic  and  central  banking 
359,r221222c,"circles  and  is  still  widely  shared  today,  having  been  further  shaped  by  the  experience  of "
360,r221222c,"stagnation accompanied by prolonged deflation in Japan starting in the late 1990s, the Global "
361,r221222c,"Financial  Crisis  (GFC)  of  the  2000s  and  responses  to  the  subsequent  recession,  and  by "
362,r221222c,responses to the COVID-19 pandemic starting in 2020. 
363,r221222c,III. Looking Ahead: Lessons from History 
364,r221222c,"Finally, I will consider future monetary policy in light of history. I would first like to consider "
365,r221222c,future economic and financial conditions. 
366,r221222c,A.  Implications  from  History  for  Future  Economic  and  Financial  Conditions  and 
367,r221222c,Monetary Policy 
368,r221222c,"Jordà et al. (2019) demonstrated that, for 16 countries including Japan from 1870 to 2015, "
369,r221222c,"the  following  relationship  between  the  real  rate  of  return  on  safe  assets  (rsafe),  the  real "
370,r221222c,"economic  growth  rate  (g),  and  the  real  rate  of  return  on  aggregate  wealth  (rwealth)  held "
371,r221222c,approximately true: 
372,r221222c,rsafe < g < rwealth. 
373,r221222c,This relationship can be understood intuitively. Safe assets have the lowest rate of return. This 
374,r221222c,is followed by the rate of return on the aggregate flow of goods and services in the economy. 
375,r221222c,"The rate of return on all assets, including risk assets, is the highest. Three further relationships "
376,r221222c,follow from this. 
377,r221222c,"First, except for the interwar period and the period between the Great Inflation and around "
378,r221222c,"the 2000s, rsafe < g held true. Although g reached the 4 percent range during the high-growth "
379,r221222c,"period following World War II, it fell to the 2 percent range in the 1970s. It then declined "
380,r221222c,"further with the onset of the GFC in the 2000s, but has recently remained at around 2 percent. "
381,r221222c,It can also be said that there is no empirical correlation between the economic growth rate 
382,r221222c,and real interest rates.22 
383,r221222c,"22  Rogoff, Rossi, and Schmelzing (2022) also did not find any clear correlation between global long- maturity real interest rates and the real economic growth rate. "
384,r221222c,14 
385,r221222c,"                                                              In a similar vein, what about developments in the natural rate of interest? While there are "
386,r221222c,"various  estimates  of  the  natural  rate  of  interest,  one  way  to  look  at  it  is  to  analyze "
387,r221222c,"developments in real interest rates. According to Schmelzing (2020), global real interest rates "
388,r221222c,have historically been on a downtrend (Chart 8).23 
389,r221222c,"Second,  except  for  the  period  of  the  two  world  wars,  g  <  rwealth  held  true. Although  the "
390,r221222c,"decrease in g and the increase in rwealth both contributed to the gap between the two figures, "
391,r221222c,the increase in rwealth is taken to have made a larger contribution. 
392,r221222c,"Third, except for limited periods, rsafe < rwealth held true. The gap between the two is equivalent "
393,r221222c,"to  risk  premia,  but  this  gap  has  been  shrinking  in  recent  years.  Under  the  Bretton Woods "
394,r221222c,"system, while rsafe was low, rwealth was high, driven upward by housing returns. However, rwealth "
395,r221222c,has been declining in recent years. 
396,r221222c,What are the implications for future monetary policy if the above relationships continue to 
397,r221222c,hold? 
398,r221222c,"First, if the natural rate of interest continues on a declining trend, the challenge for central "
399,r221222c,banks' monetary policy will continue to be how to lower real interest rates in an effective 
400,r221222c,"manner. Faced with the zero lower bound (ZLB) in an era of low inflation, central banks have "
401,r221222c,taken steps to boost the effectiveness of their monetary policy. Various proposals have been 
402,r221222c,"made to improve policy objectives (Chart 9). As a result, central banks have reaffirmed the "
403,r221222c,"importance of committing to the 2 percent inflation target. With regard to policy measures, "
404,r221222c,"the Bank of Japan, for example, has introduced such measures as quantitative easing, negative "
405,r221222c,"interest rates, diversification of asset purchasing, yield curve control, and forward guidance. "
406,r221222c,"The  necessity  for  policy  innovation  to  boost  the  effectiveness  of  monetary  policy,  both  in "
407,r221222c,"terms of policy objectives and measures, may increase; it certainly will not diminish.24 "
408,r221222c,"23  Due to data limitations, global real interest rates in this study were calculated from GDP-weighted  nominal interest rates and inflation rates using available data for eight countries: Italy, the Netherlands,  France, Spain, the United Kingdom, Germany, the United States, and Japan. Since the study does not  take into account the recent rise of China and emerging economies, the possibility of underestimation  warrants attention.  24  Bernanke (2022, pp. 330-65) elaborates on this point. "
409,r221222c,15 
410,r221222c,"                                                                Second,  if  g  <  rwealth,  this  implies  that  the  uptrend  in  the  ratio  of  total  assets  to  GDP  will "
411,r221222c,"continue. If there is a certain positive correlation between total assets and total liabilities, this "
412,r221222c,means that the ratio of total liabilities to GDP will also trend upward. This in turn means that 
413,r221222c,asset price fluctuations will have a growing impact on the economy through asset (liability) 
414,r221222c,balances. 
415,r221222c,"Third, decreasing risk premia can lead to the underpricing of risks. Krishnamurthy and Muir "
416,r221222c,(2017)  argue  that  financial  crises  frequently  occur  when  risk  premia  shrink  and  risk  is 
417,r221222c,underpriced.  Central  banks  will  increasingly  need  to  prepare  macroprudential  policies  to 
418,r221222c,maintain stability in the financial system. 
419,r221222c,The above considerations are based on history and past trends. Should these trends change 
420,r221222c,"significantly, my conclusions will also change. We cannot rule out the possibility that such "
421,r221222c,"major changes will occur in the future. However, as I said earlier in section I., it is uncertain "
422,r221222c,"whether the natural rate of interest will rise as a trend in the future. On the contrary, we cannot "
423,r221222c,deny the possibility of an ongoing decline in the natural rate of interest. What history over 
424,r221222c,"the long term makes apparent is that the mild-inflation regime has not come to an end, and "
425,r221222c,we should say that the potential dangers of secular stagnation and Japanification have not yet 
426,r221222c,passed. 
427,r221222c,B.  Introduction  and Achievements  of  Quantitative  and  Qualitative  Monetary  Easing 
428,r221222c,(QQE) 
429,r221222c,"There is no need for pessimism, however, even during periods of Japanification. Having long "
430,r221222c,"been mired in deflation, the policy change made in Japan with the introduction of QQE in "
431,r221222c,"April 2013 has produced positive effects. Even before its introduction, economic growth had "
432,r221222c,"been  achieved  despite  the  declining  labor  force  population,  but  the  GDP  growth  rate  has "
433,r221222c,"improved and prices have risen clearly since 2013, as the unemployment rate declined and "
434,r221222c,the number of employed persons increased (Charts 10 and 11). The overall GDP growth rate 
435,r221222c,"has been low because the labor force population has been declining; however, if we look at "
436,r221222c,"the real GDP growth rate per capita, which takes into account changes in the employment rate "
437,r221222c,"over time, we see that, while the rate was at 0.4 percent in the 2000s, it recovered to the 1990s "
438,r221222c,level of 1.3 percent in the 2010s (Chart 12). This suggests that there was a rise in productivity 
439,r221222c,16 
440,r221222c,          per worker and in the labor force participation rate. Improved employment conditions led to 
441,r221222c,an increase in the employment rate for new graduates and ended the so-called employment 
442,r221222c,"ice  age.  Of  course,  providing  support  for  those  who  struggled  to  find  jobs  during  the "
443,r221222c,employment ice age remains a crucial task. In order to create an environment that can provide 
444,r221222c,"employment  opportunities  for  this  generation,  it  is  important  to  maintain  a  high-pressure "
445,r221222c,"economy. While the year-on-year rate of change in the consumer price index (CPI, all items "
446,r221222c,"less fresh food) was on average minus 0.3 percent between fiscal 1998 and fiscal 2012, the "
447,r221222c,average rate from fiscal 2013 onward rose to 0.4 percent (Chart 13). Although it is true that 
448,r221222c,"the price stability target of 2 percent has not yet been achieved, we are now in a situation "
449,r221222c,"where the economy is no longer in deflation, in the sense of a sustained decline in prices.25 "
450,r221222c,These improvements in economic activity and prices were made following the adoption of 
451,r221222c,the  price  stability  target  of  2  percent  in  2013.  Japan's  economy  was  in  deflation  for  a 
452,r221222c,"prolonged period, but sustainable monetary easing certainly had positive effects on the real "
453,r221222c,"economy. Consequently, it can be said that this provides evidence that QQE supports the idea "
454,r221222c,of a high-pressure economy. 
455,r221222c,Conclusion 
456,r221222c,"Today,  I  considered  the  narrative  that,  with  the  end  of  the  mild-inflationary  regime "
457,r221222c,"accompanied by anxiety over deflation, concern about secular stagnation and Japanification "
458,r221222c,"has passed into history, and that a regime of high inflation will emerge. Against this narrative, "
459,r221222c,I have argued that the threat of secular stagnation and Japanification has not yet been dispelled 
460,r221222c,"completely. This is because cost-push factors, real factors, and changes in the natural rate of "
461,r221222c,interest  --  the  factors  that  are  usually  pointed  out  --  do  not  necessarily  suggest  sustained 
462,r221222c,"inflation;  rather,  it  is  important  to  take  monetary  factors  into  consideration  to  determine "
463,r221222c,whether inflation will be sustainable. 
464,r221222c,"As Hicks's words introduced at the beginning of the speech indicate, the field of monetary "
465,r221222c,economics  has  changed  over  time  in  accordance  with  actual  economic  and  financial 
466,r221222c,"developments. After having experienced price fluctuations, monetary economics has become "
467,r221222c,"increasingly aware of the importance of price stability. Moreover, not only have there been "
468,r221222c,"25  For details of the relationship between wages and prices, see section II. B. in Wakatabe (2022). "
469,r221222c,17 
470,r221222c,                                                              persistent so-called inflation fears but also deflation fears. While the quantity theory of money 
471,r221222c,is commonly characterized by its argument for the short-run non-neutrality of money and the 
472,r221222c,"long-run neutrality of money, the possibility of money being non-neutral in the long run has "
473,r221222c,also been pointed out since the theory was first developed. This reflects the fact that prices 
474,r221222c,"are not completely adjusted in markets. Later, with the growth of the credit economy, two-"
475,r221222c,interest-rate analysis was developed. As the divergence between the two interest rates will 
476,r221222c,"not automatically be adjusted under the fiat money system, the role of the central bank as the "
477,r221222c,issuer of money is essential in order to ensure price stability. 
478,r221222c,"The  current  model  of  monetary  economics  may  need  to  be  changed,  depending  on  future "
479,r221222c,"circumstances. That said, the lessons learned from history are that it is monetary factors that "
480,r221222c,are  important  in  determining  whether  an  economy  is  being  subject  to  inflationary  or 
481,r221222c,"deflationary pressure, and that monetary policy conducted by central banks will play a vital "
482,r221222c,role since it controls the quantity of money. 
